{
  "schema_version": "1.0",
  "status": "passed",
  "offline_fallback_used": false,
  "checks": {
    "terraform_fmt": {"status": "passed", "command": "terraform fmt -check -recursive terraform", "evidence": "All generated Terraform files were already formatted."},
    "terraform_init": {"status": "passed", "command": "terraform init -backend=false -input=false", "evidence": "Provider initialization completed for the fixture validation run."},
    "terraform_validate": {"status": "passed", "command": "terraform validate", "evidence": "Terraform configuration validation completed."},
    "policy": {"status": "passed", "command": "validate-terraform-policy.py terraform --json .policy-verdict.tmp.json", "evidence": "Local policy validator returned POLICY_OK.", "policy_status": "POLICY_OK", "violations": []},
    "secret_scan": {"status": "passed", "command": "gitleaks detect --no-git --source generated", "evidence": "No generated secret finding was reported."},
    "schemas": {"status": "passed", "command": "jsonschema generation-warnings.json validation-report.json", "evidence": "Schemas and cross-artifact accounting passed."},
    "report": {"status": "passed", "command": "validate-render-migration-report.py migration-report.html --migration-dir .", "evidence": "The skill-local report validator returned REPORT_OK."}
  },
  "timestamp": "2026-10-21T12:00:00Z"
}
